[
  {
    "forecast_id": "382cda54-1228-5566-a504-d90c479d7fb2",
    "corridor": "HORMUZ",
    "origin_date": "2026-06-30",
    "horizon_days": 7,
    "model_source": "GRU",
    "training_data_through": "2026-05-16",
    "feature_data_through": "2026-06-30",
    "trajectory": [
      {
        "forecast_date": "2026-07-01",
        "score_band": {
          "p10": 0.0053,
          "p50": 0.0053,
          "p90": 0.0434
        }
      },
      {
        "forecast_date": "2026-07-02",
        "score_band": {
          "p10": 0.0054,
          "p50": 0.0054,
          "p90": 0.0362
        }
      },
      {
        "forecast_date": "2026-07-03",
        "score_band": {
          "p10": 0.0025,
          "p50": 0.0092,
          "p90": 0.0303
        }
      },
      {
        "forecast_date": "2026-07-04",
        "score_band": {
          "p10": 0.0038,
          "p50": 0.0038,
          "p90": 0.0262
        }
      },
      {
        "forecast_date": "2026-07-05",
        "score_band": {
          "p10": 0.0054,
          "p50": 0.0054,
          "p90": 0.025
        }
      },
      {
        "forecast_date": "2026-07-06",
        "score_band": {
          "p10": 0.003,
          "p50": 0.003,
          "p90": 0.0256
        }
      },
      {
        "forecast_date": "2026-07-07",
        "score_band": {
          "p10": 0.0039,
          "p50": 0.0039,
          "p90": 0.0239
        }
      }
    ]
  },
  {
    "forecast_id": "7ec2c0ce-7951-5956-b188-43818a4a9332",
    "corridor": "BAB_EL_MANDEB",
    "origin_date": "2026-06-30",
    "horizon_days": 7,
    "model_source": "GRU",
    "training_data_through": "2026-05-16",
    "feature_data_through": "2026-06-30",
    "trajectory": [
      {
        "forecast_date": "2026-07-01",
        "score_band": {
          "p10": 0.0053,
          "p50": 0.0053,
          "p90": 0.0436
        }
      },
      {
        "forecast_date": "2026-07-02",
        "score_band": {
          "p10": 0.0054,
          "p50": 0.0054,
          "p90": 0.0361
        }
      },
      {
        "forecast_date": "2026-07-03",
        "score_band": {
          "p10": 0.0025,
          "p50": 0.0093,
          "p90": 0.0304
        }
      },
      {
        "forecast_date": "2026-07-04",
        "score_band": {
          "p10": 0.0038,
          "p50": 0.0038,
          "p90": 0.026
        }
      },
      {
        "forecast_date": "2026-07-05",
        "score_band": {
          "p10": 0.0055,
          "p50": 0.0055,
          "p90": 0.0249
        }
      },
      {
        "forecast_date": "2026-07-06",
        "score_band": {
          "p10": 0.003,
          "p50": 0.003,
          "p90": 0.0255
        }
      },
      {
        "forecast_date": "2026-07-07",
        "score_band": {
          "p10": 0.004,
          "p50": 0.004,
          "p90": 0.0243
        }
      }
    ]
  },
  {
    "forecast_id": "ca293e5b-df99-5b3d-987f-ba47187b632e",
    "corridor": "MALACCA",
    "origin_date": "2026-06-30",
    "horizon_days": 7,
    "model_source": "GRU",
    "training_data_through": "2026-05-16",
    "feature_data_through": "2026-06-30",
    "trajectory": [
      {
        "forecast_date": "2026-07-01",
        "score_band": {
          "p10": 0.0052,
          "p50": 0.0052,
          "p90": 0.0441
        }
      },
      {
        "forecast_date": "2026-07-02",
        "score_band": {
          "p10": 0.0055,
          "p50": 0.0055,
          "p90": 0.037
        }
      },
      {
        "forecast_date": "2026-07-03",
        "score_band": {
          "p10": 0.0024,
          "p50": 0.009,
          "p90": 0.0299
        }
      },
      {
        "forecast_date": "2026-07-04",
        "score_band": {
          "p10": 0.0037,
          "p50": 0.0037,
          "p90": 0.0268
        }
      },
      {
        "forecast_date": "2026-07-05",
        "score_band": {
          "p10": 0.0054,
          "p50": 0.0054,
          "p90": 0.0252
        }
      },
      {
        "forecast_date": "2026-07-06",
        "score_band": {
          "p10": 0.003,
          "p50": 0.003,
          "p90": 0.0259
        }
      },
      {
        "forecast_date": "2026-07-07",
        "score_band": {
          "p10": 0.004,
          "p50": 0.004,
          "p90": 0.024
        }
      }
    ]
  },
  {
    "forecast_id": "41ba5274-ce45-54ba-a419-7cf8e8b272ba",
    "corridor": "OTHER",
    "origin_date": "2026-06-30",
    "horizon_days": 7,
    "model_source": "TREND_FALLBACK",
    "training_data_through": "2026-05-16",
    "feature_data_through": "2026-06-30",
    "trajectory": [
      {
        "forecast_date": "2026-07-01",
        "score_band": {
          "p10": 0.0,
          "p50": 0.0,
          "p90": 0.05
        }
      },
      {
        "forecast_date": "2026-07-02",
        "score_band": {
          "p10": 0.0,
          "p50": 0.0,
          "p90": 0.05
        }
      },
      {
        "forecast_date": "2026-07-03",
        "score_band": {
          "p10": 0.0,
          "p50": 0.0,
          "p90": 0.05
        }
      },
      {
        "forecast_date": "2026-07-04",
        "score_band": {
          "p10": 0.0,
          "p50": 0.0,
          "p90": 0.05
        }
      },
      {
        "forecast_date": "2026-07-05",
        "score_band": {
          "p10": 0.0,
          "p50": 0.0,
          "p90": 0.05
        }
      },
      {
        "forecast_date": "2026-07-06",
        "score_band": {
          "p10": 0.0,
          "p50": 0.0,
          "p90": 0.05
        }
      },
      {
        "forecast_date": "2026-07-07",
        "score_band": {
          "p10": 0.0,
          "p50": 0.0,
          "p90": 0.05
        }
      }
    ]
  }
]